id,conversation_id,created_at,date,time,timezone,user_id,username,name,place,tweet,language,mentions,urls,photos,replies_count,retweets_count,likes_count,hashtags,cashtags,link,retweet,quote_url,video,thumbnail,near,geo,source,user_rt_id,user_rt,retweet_id,reply_to,retweet_date,translate,trans_src,trans_dest
1579289003437588480,1579289003437588480	,2022-10-10 09:53:34 Malay Peninsula Standard Time,2022-10-10,09:53:34,+0800,2361631088,cathiedwood,Cathie Wood,,"Given the accelerated consumer preference shift toward electric vehicles, used car prices and the residual value of all gas powered autos are likely to plummet, causing serious losses in the $1 trillion auto debt market.",en,[],[],[],1515,993,8467,[],[],https://twitter.com/CathieDWood/status/1579289003437588480,,https://twitter.com/skorusARK/status/1578374484196700161,0,,,,,,,,"{'user_id': None, 'username': None}",,,,
1577435172592816128,1577435172592816128	,2022-10-05 07:07:07 Malay Peninsula Standard Time,2022-10-05,07:07:07,+0800,2361631088,cathiedwood,Cathie Wood,,"Thrilled to welcome @WClementeIII as guest author of The Bitcoin Monthly, and happy that on-chain analysis is highlighting, on balance, solid fundamental support for bitcoin.",en,['wclementeiii'],[],[],274,248,2076,[],[],https://twitter.com/CathieDWood/status/1577435172592816128,,https://twitter.com/yassineARK/status/1577430197359431681,0,,,,,,,,"{'user_id': None, 'username': None}",,,,
1575756080311066624,1575756080311066624	,2022-09-30 15:55:00 Malay Peninsula Standard Time,2022-09-30,15:55:00,+0800,2361631088,cathiedwood,Cathie Wood,,"For those skeptical of our interest rate shock thesis (13.5x increase in the Fed funds rate in this cycle compared to 2x under Volcker), the UK pension fund LDI debacle is proof of concept.",en,[],[],[],287,184,1746,[],[],https://twitter.com/CathieDWood/status/1575756080311066624,,,0,,,,,,,,"{'user_id': None, 'username': None}",,,,
1574513503985348608,1574513481436520461	,2022-09-27 05:37:27 Malay Peninsula Standard Time,2022-09-27,05:37:27,+0800,2361631088,cathiedwood,Cathie Wood,,"Japan’s and China’s dollar sales could be the first sign that “monetary easing” is on the way. The dollar’s parabolic move has been devastating to the rest of the world and should come back to bite US competitiveness, jobs, and  and economic activity, forcing the Fed to pivot.",en,[],[],[],156,167,1360,[],[],https://twitter.com/CathieDWood/status/1574513503985348608,,,0,,,,,,,,"{'user_id': '2361631088', 'username': 'CathieDWood'}",,,,
1574513501066100736,1574513481436520461	,2022-09-27 05:37:26 Malay Peninsula Standard Time,2022-09-27,05:37:26,+0800,2361631088,cathiedwood,Cathie Wood,,"Last week, Japan and China sold dollars to protect their currencies against a parabolic dollar that is causing significant harm to the global economy. In other words, they are starting to “ease” dollar-based monetary policy by putting more dollars into the system.",en,[],[],[],15,62,708,[],[],https://twitter.com/CathieDWood/status/1574513501066100736,,,0,,,,,,,,"{'user_id': '2361631088', 'username': 'CathieDWood'}",,,,
1574513498184245248,1574513481436520461	,2022-09-27 05:37:25 Malay Peninsula Standard Time,2022-09-27,05:37:25,+0800,2361631088,cathiedwood,Cathie Wood,,"By the time this Fed tackled the current surge, inflation had been brewing for ~15 months, not 15 years. Now, it is “keeping at it” with a sledgehammer 13 times more powerful than the one Volcker wielded in the ‘80s. In so doing, the Fed could undermine its legacy.",en,[],[],[],26,32,394,[],[],https://twitter.com/CathieDWood/status/1574513498184245248,,,0,,,,,,,,"{'user_id': '2361631088', 'username': 'CathieDWood'}",,,,
1574513495319760896,1574513481436520461	,2022-09-27 05:37:24 Malay Peninsula Standard Time,2022-09-27,05:37:24,+0800,2361631088,cathiedwood,Cathie Wood,,"The inflation surge in the late seventies/early eighties had been brewing for 15 years, starting with the  Vietnam War and The Great Society social programs in 1964 and exacerbated by the end of the gold-exchange standard in 1971.",en,[],[],[],10,19,299,[],[],https://twitter.com/CathieDWood/status/1574513495319760896,,,0,,,,,,,,"{'user_id': '2361631088', 'username': 'CathieDWood'}",,,,
1574513492689838097,1574513481436520461	,2022-09-27 05:37:24 Malay Peninsula Standard Time,2022-09-27,05:37:24,+0800,2361631088,cathiedwood,Cathie Wood,,A 58% increase in the trade-weighted dollar since early 2008 helps to explain the deflationary forces that are building in the pipeline once again. Most commodities are priced in dollars.,en,[],[],[],4,17,280,[],[],https://twitter.com/CathieDWood/status/1574513492689838097,,,0,,,,,,,,"{'user_id': '2361631088', 'username': 'CathieDWood'}",,,,
1574513489820979205,1574513481436520461	,2022-09-27 05:37:23 Malay Peninsula Standard Time,2022-09-27,05:37:23,+0800,2361631088,cathiedwood,Cathie Wood,,"Meanwhile, commodity prices as measured by Refinitiv’s CRB index have dropped ~42% since their peak in mid 2008, ~25% since their lower peak in 2011, and ~19% since an even lower peak earlier this year.",en,[],[],[],3,17,313,[],[],https://twitter.com/CathieDWood/status/1574513489820979205,,,0,,,,,,,,"{'user_id': '2361631088', 'username': 'CathieDWood'}",,,,
1574513486981480448,1574513481436520461	,2022-09-27 05:37:22 Malay Peninsula Standard Time,2022-09-27,05:37:22,+0800,2361631088,cathiedwood,Cathie Wood,,"Under Volcker, the increase in long Treasury yields was 1.6X, from 10% to 16%, compared to 7.4X, from 0.5% to 3.7% under Powell and team. Risk aversion is pummeling all assets except cash, but the Fed seems fixated on hiking rates another 100+ basis points to protect its legacy.",en,[],[],[],64,24,404,[],[],https://twitter.com/CathieDWood/status/1574513486981480448,,,0,,,,,,,,"{'user_id': '2361631088', 'username': 'CathieDWood'}",,,,
1574513484422864912,1574513481436520461	,2022-09-27 05:37:22 Malay Peninsula Standard Time,2022-09-27,05:37:22,+0800,2361631088,cathiedwood,Cathie Wood,,"In @ARKInvest’s view, US monetary policy is significantly more restrictive than in the ‘80s when, to kill inflation, Fed Chair Volcker pushed the Fed funds rate up two-fold from 10% to 20%. Chair Powell and team have increased it 13-fold from 0.25% to 3.25% to slay the dragon.",en,['arkinvest'],[],[],79,43,481,[],[],https://twitter.com/CathieDWood/status/1574513484422864912,,,0,,,,,,,,"{'user_id': '2361631088', 'username': 'CathieDWood'}",,,,
1574513481436520461,1574513481436520461	,2022-09-27 05:37:21 Malay Peninsula Standard Time,2022-09-27,05:37:21,+0800,2361631088,cathiedwood,Cathie Wood,,"The yield curve “suggests” that US monetary policy has not been this restrictive since the ‘80s. As measured by the 2-year Treasury yield relative to the 10-year Treasury yield, it has inverted by 50 basis points, the 10-year yield at 3.75% compared to the two-year at 4.25%.",en,[],[],[],291,405,2571,[],[],https://twitter.com/CathieDWood/status/1574513481436520461,,,0,,,,,,,,"{'user_id': None, 'username': None}",,,,
1572715061441069056,1572715061441069056	,2022-09-22 06:31:04 Malay Peninsula Standard Time,2022-09-22,06:31:04,+0800,2361631088,cathiedwood,Cathie Wood,,Most disappointing about the Fed’s decision today was its unanimity. None of those voting on the Federal Reserve is focused on the significant price deflation in the pipeline. The Fed seems to be making decisions based on lagging indicators and analogies. See @elonmusk.,en,['elonmusk'],[],[],727,352,2770,[],[],https://twitter.com/CathieDWood/status/1572715061441069056,,https://twitter.com/CathieDWood/status/1571246847116582912,0,,,,,,,,"{'user_id': None, 'username': None}",,,,
1572233508872912898,1572233508872912898	,2022-09-20 22:37:33 Malay Peninsula Standard Time,2022-09-20,22:37:33,+0800,2361631088,cathiedwood,Cathie Wood,,Tesla should become a prime example as autonomous mobility takes off.,en,[],[],[],118,69,723,[],[],https://twitter.com/CathieDWood/status/1572233508872912898,,https://twitter.com/summerlinARK/status/1571240708823998464,0,,,,,,,,"{'user_id': None, 'username': None}",,,,
1572225923038203906,1572225923038203906	,2022-09-20 22:07:25 Malay Peninsula Standard Time,2022-09-20,22:07:25,+0800,2361631088,cathiedwood,Cathie Wood,,"@Nouriel seems to be causing the same problem. In our view, Summers, Roubini, and others forecasting intractable ‘70’s-style inflation will be blindsided by outright deflation. Headline inflation already is unwinding sequentially, thanks to monetary and fiscal (ex IRA) restraint",en,['nouriel'],[],[],9,2,16,[],[],https://twitter.com/CathieDWood/status/1572225923038203906,,https://twitter.com/CathieDWood/status/1571246847116582912,0,,,,,,,,"{'user_id': '19224439', 'username': 'Nouriel'}",,,,
1572220863142940672,1572220863142940672	,2022-09-20 21:47:18 Malay Peninsula Standard Time,2022-09-20,21:47:18,+0800,2361631088,cathiedwood,Cathie Wood,,"Demand destruction. Gasoline demand in the US has dropped below the level hit during the depths of the coronavirus in 2020 to levels last seen 25 years ago in 1997, even though the number of cars on the road - most of them gas-powered - is much higher than it was 25 years ago.",en,[],[],[],119,109,821,[],[],https://twitter.com/CathieDWood/status/1572220863142940672,,https://twitter.com/Jason/status/1571884301796659200,0,,,,,,,,"{'user_id': None, 'username': None}",,,,
1571246851210313737,1571246847116582912	,2022-09-18 05:16:56 Malay Peninsula Standard Time,2022-09-18,05:16:56,+0800,2361631088,cathiedwood,Cathie Wood,,"This inflation started fewer than two years ago with COVID and supply chain bottlenecks, exacerbated by Russia’s invasion of Ukraine this year. The Fed is solving supply chain issues by crushing demand and, in my view, unleashing deflation, setting it up for a major pivot.",en,[],[],[],208,149,1484,[],[],https://twitter.com/CathieDWood/status/1571246851210313737,,,0,,,,,,,,"{'user_id': '2361631088', 'username': 'CathieDWood'}",,,,
1571246847116582912,1571246847116582912	,2022-09-18 05:16:55 Malay Peninsula Standard Time,2022-09-18,05:16:55,+0800,2361631088,cathiedwood,Cathie Wood,,"Larry Summers seems to be leading the Biden administration astray with his conviction that inflation is intractable, with the ‘70s as his guide. The ‘70s inflation started in 1964 with the Vietnam War and the Great Society and burgeoned for 15 years.",en,[],[],[],382,526,5563,[],[],https://twitter.com/CathieDWood/status/1571246847116582912,,https://twitter.com/CathieDWood/status/1569182368954724352,0,,,,,,,,"{'user_id': None, 'username': None}",,,,
1570164724859273217,1570164724859273217	,2022-09-15 05:36:57 Malay Peninsula Standard Time,2022-09-15,05:36:57,+0800,2361631088,cathiedwood,Cathie Wood,,"The difference between linear and exponential growth rates should continue to throw analysts’ forecasts for $TSLA and other EV manufacturers off course. In terms of units, the difference will approach 40 million (59 million-21 million) by 2027.",en,[],[],[],164,123,789,[],['TSLA'],https://twitter.com/CathieDWood/status/1570164724859273217,,https://twitter.com/skorusARK/status/1570158233553092610,0,,,,,,,,"{'user_id': None, 'username': None}",,,,
1569182377708077056,1569182368954724352	,2022-09-12 12:33:27 Malay Peninsula Standard Time,2022-09-12,12:33:27,+0800,2361631088,cathiedwood,Cathie Wood,,"This time around, thanks to ride-hailing - and soon less expensive autonomous taxis - individuals are unlikely to prioritize auto debt payments over mortgage payments, which could turn backward-looking quant models upside down.",en,[],[],[],107,40,923,[],[],https://twitter.com/CathieDWood/status/1569182377708077056,,,0,,,,,,,,"{'user_id': '2361631088', 'username': 'CathieDWood'}",,,,
1569182375728369664,1569182368954724352	,2022-09-12 12:33:27 Malay Peninsula Standard Time,2022-09-12,12:33:27,+0800,2361631088,cathiedwood,Cathie Wood,,"If residual auto values deteriorate accordingly, the $1+ trillion in US auto debt will be in harm’s way. Autos were the best credit in 2008-09, as individuals prioritized their auto loan payments at the expense of mortgages so they could get to work and stay employed.",en,[],[],[],22,35,698,[],[],https://twitter.com/CathieDWood/status/1569182375728369664,,,0,,,,,,,,"{'user_id': '2361631088', 'username': 'CathieDWood'}",,,,
1569182372091797504,1569182368954724352	,2022-09-12 12:33:26 Malay Peninsula Standard Time,2022-09-12,12:33:26,+0800,2361631088,cathiedwood,Cathie Wood,,"As measured by the Manheim, used car prices dropped 4% in August (roughly 50% at an annual rate!), have dropped 10% since peaking in January, and if electric vehicles are as disruptive as we believe, could be cut in half, hitting lows last seen during the GFC in late 2008.",en,[],[],[],29,37,597,[],[],https://twitter.com/CathieDWood/status/1569182372091797504,,,0,,,,,,,,"{'user_id': '2361631088', 'username': 'CathieDWood'}",,,,
1569182368954724352,1569182368954724352	,2022-09-12 12:33:25 Malay Peninsula Standard Time,2022-09-12,12:33:25,+0800,2361631088,cathiedwood,Cathie Wood,,"Deflation in the pipeline, heading for the PPI, CPI, PCE Deflator: from post-COVID price peaks, lumber -60%, copper -35%, oil -35%, iron ore -60%, DRAM -46%, corn -17%, Baltic freight rates -79%, gold -17%, and silver -39%.",en,[],[],[],624,1152,10225,[],[],https://twitter.com/CathieDWood/status/1569182368954724352,,https://twitter.com/elonmusk/status/1568383953370767365,0,,,,,,,,"{'user_id': None, 'username': None}",,,,
1567648683763580928,1567648667766558721	,2022-09-08 06:59:06 Malay Peninsula Standard Time,2022-09-08,06:59:06,+0800,2361631088,cathiedwood,Cathie Wood,,"Innovation solves problems, and the world is facing many more problems today than two years ago. Innovation is key to real growth!",en,[],[],[],129,85,1020,[],[],https://twitter.com/CathieDWood/status/1567648683763580928,,,0,,,,,,,,"{'user_id': '2361631088', 'username': 'CathieDWood'}",,,,
1567648681918173184,1567648667766558721	,2022-09-08 06:59:05 Malay Peninsula Standard Time,2022-09-08,06:59:05,+0800,2361631088,cathiedwood,Cathie Wood,,The Fed seems to responding to COVID-related supply shocks spanning 15 months the same way that Volcker battled inflation that had been brewing and building for 15 years. I would not be surprised to see a significant policy pivot in the next three to six months.,en,[],[],[],48,63,693,[],[],https://twitter.com/CathieDWood/status/1567648681918173184,,,0,,,,,,,,"{'user_id': '2361631088', 'username': 'CathieDWood'}",,,,
1567648679334387713,1567648667766558721	,2022-09-08 06:59:05 Malay Peninsula Standard Time,2022-09-08,06:59:05,+0800,2361631088,cathiedwood,Cathie Wood,,"Further downstream, retailers seem to be swimming in inventories which they could be forced to discount aggressively to clear the shelves for holiday merchandise. The surprise could be deflation in the CPI and PCE deflator by year-end.",en,[],[],[],23,20,324,[],[],https://twitter.com/CathieDWood/status/1567648679334387713,,,0,,,,,,,,"{'user_id': '2361631088', 'username': 'CathieDWood'}",,,,
1567648677560291328,1567648667766558721	,2022-09-08 06:59:04 Malay Peninsula Standard Time,2022-09-08,06:59:04,+0800,2361631088,cathiedwood,Cathie Wood,,"In the pipeline, inflation is turning into deflation. One of the best inflation gauges, the gold price peaked more than two years ago in August 2020 at $2075 and has dropped ~15%. Lumber prices have dropped more than 60%, copper -30%, iron ore -60%, DRAM -46%, and crude oil -35%.",en,[],[],[],36,27,367,[],[],https://twitter.com/CathieDWood/status/1567648677560291328,,,0,,,,,,,,"{'user_id': '2361631088', 'username': 'CathieDWood'}",,,,
1567648675635073025,1567648667766558721	,2022-09-08 06:59:04 Malay Peninsula Standard Time,2022-09-08,06:59:04,+0800,2361631088,cathiedwood,Cathie Wood,,"The Fed has raised the Fed funds rate 10-fold from 0.25% to 2.50%, five times Volcker’s 2-fold increase from 10% to 20% in the early ‘80s when consumers and businesses had been adjusting to inflation for 10-15 years. In contrast, today they are in shock. Housing is unraveling.",en,[],[],[],131,32,410,[],[],https://twitter.com/CathieDWood/status/1567648675635073025,,,0,,,,,,,,"{'user_id': '2361631088', 'username': 'CathieDWood'}",,,,
1567648672485187584,1567648667766558721	,2022-09-08 06:59:03 Malay Peninsula Standard Time,2022-09-08,06:59:03,+0800,2361631088,cathiedwood,Cathie Wood,,"Not ‘til Volcker took charge in 1979, 15 years after the Vietnam War and Great Society began, did the Fed attack inflation decisively. In contrast, faced with a two year supply-related inflation shock, Powell is using Volcker’s sledgehammer and, I believe, making a mistake.",en,[],[],[],14,22,300,[],[],https://twitter.com/CathieDWood/status/1567648672485187584,,,0,,,,,,,,"{'user_id': '2361631088', 'username': 'CathieDWood'}",,,,
1567648670446673921,1567648667766558721	,2022-09-08 06:59:03 Malay Peninsula Standard Time,2022-09-08,06:59:03,+0800,2361631088,cathiedwood,Cathie Wood,,"At Jackson Hole, Chairman Powell invoked Volcker’s name twice directly, twice indirectly. Today’s COVID-supply-shock inflation is nothing like the ‘70s inflation that started with “guns and butter” in 1964, and accelerated after Nixon ended the gold-exchange standard in 1971.",en,[],[],[],8,16,274,[],[],https://twitter.com/CathieDWood/status/1567648670446673921,,,0,,,,,,,,"{'user_id': '2361631088', 'username': 'CathieDWood'}",,,,
1567648667766558721,1567648667766558721	,2022-09-08 06:59:02 Malay Peninsula Standard Time,2022-09-08,06:59:02,+0800,2361631088,cathiedwood,Cathie Wood,,"The Fed is basing monetary policy decisions on lagging indicators: employment and core inflation. Leading inflation indicators like gold and copper are flagging the risk of deflation. Even the oil price has dropped more than 35% from its peak, erasing most of the gain this year.",en,[],[],[],258,308,1945,[],[],https://twitter.com/CathieDWood/status/1567648667766558721,,https://twitter.com/ARKInvest/status/1566035275456864256,0,,,,,,,,"{'user_id': None, 'username': None}",,,,
1565177724825747457,1565177724825747457	,2022-09-01 11:20:23 Malay Peninsula Standard Time,2022-09-01,11:20:23,+0800,2361631088,cathiedwood,Cathie Wood,,"In the last two weeks, while the well-regarded JAMA has featured studies that both support and refute the benefits of #psychedelics, @ARKInvest’s life science analyst, @PierceARK, is helping us size the potential market. Thank you @C_Angermayer for your support and inspiration!",en,"['arkinvest', 'pierceark', 'c_angermayer']",[],[],85,48,374,['psychedelics'],[],https://twitter.com/CathieDWood/status/1565177724825747457,,https://twitter.com/PierceARK/status/1565114443221979136,0,,,,,,,,"{'user_id': None, 'username': None}",,,,
1559977821765701632,1559977819253329920	,2022-08-18 02:57:50 Malay Peninsula Standard Time,2022-08-18,02:57:50,+0800,2361631088,cathiedwood,Cathie Wood,,"We would not be surprised to see new and used car prices unwind fairly dramatically, threatening auto residual values and the $1+ trillion in auto credit in the US during the next year.",en,[],[],[],64,49,547,[],[],https://twitter.com/CathieDWood/status/1559977821765701632,,,0,,,,,,,,"{'user_id': '2361631088', 'username': 'CathieDWood'}",,,,
1559977819253329920,1559977819253329920	,2022-08-18 02:57:49 Malay Peninsula Standard Time,2022-08-18,02:57:49,+0800,2361631088,cathiedwood,Cathie Wood,,"To avoid mass transit, consumers hoarded cars in 2020-21. While used car prices were rising, they were enjoying “inventory profits” and probably were in no rush to sell after the crisis. Now prices are falling, threatening them with inventory losses, so they are likely to sell.",en,[],[],[],112,68,564,[],[],https://twitter.com/CathieDWood/status/1559977819253329920,,https://twitter.com/trader_jalapeno/status/1559899959478165505,0,,,,,,,,"{'user_id': None, 'username': None}",,,,
1558875838707277824,1558875838707277824	,2022-08-15 01:58:57 Malay Peninsula Standard Time,2022-08-15,01:58:57,+0800,2361631088,cathiedwood,Cathie Wood,,.@aurmanARK’s research is helping @ARKInvest understand how profound the various implementations of gene editing could become in transforming medicine from treating the symptoms of disease to curing disease.,en,"['aurmanark', 'arkinvest']",[],[],76,38,307,[],[],https://twitter.com/CathieDWood/status/1558875838707277824,,https://twitter.com/aurmanARK/status/1558433351953948672,0,,,,,,,,"{'user_id': None, 'username': None}",,,,
1556390890398154755,1556390890398154755	,2022-08-08 05:24:39 Malay Peninsula Standard Time,2022-08-08,05:24:39,+0800,2361631088,cathiedwood,Cathie Wood,,I founded ARK 100 years later to the day!,en,[],[],[],89,25,599,[],[],https://twitter.com/CathieDWood/status/1556390890398154755,,https://twitter.com/CathieDWood/status/1556389800051179520,0,,,,,,,,"{'user_id': None, 'username': None}",,,,
1556389800051179520,1556389800051179520	,2022-08-08 05:20:19 Malay Peninsula Standard Time,2022-08-08,05:20:19,+0800,2361631088,cathiedwood,Cathie Wood,,"The first commercial airplane flight in the world was on January 1, 1914 from St. Pete, @ARKInvest’s home, to Tampa, putting the Tampa Bay region at the forefront of innovation. Let’s do it again Tampa Bay/ARK Innovation Center and @EmbarcCollectiv!",en,"['arkinvest', 'embarccollectiv']",[],[],61,37,463,[],[],https://twitter.com/CathieDWood/status/1556389800051179520,,https://twitter.com/pitdesi/status/1555986244735156224,0,,,,,,,,"{'user_id': None, 'username': None}",,,,
1554672065319419904,1554672065319419904	,2022-08-03 11:34:39 Malay Peninsula Standard Time,2022-08-03,11:34:39,+0800,2361631088,cathiedwood,Cathie Wood,,"In The Bitcoin Monthly, @yassineARK, @downingARK, and @dpuellARK harness on-chain crypto analytics and macroeconomic analysis to understand crypto market dynamics. Thanks to the transparency of crypto networks, the weight of the evidence suggests that the worst is behind us.",en,"['yassineark', 'downingark', 'dpuellark']",[],[],112,70,498,[],[],https://twitter.com/CathieDWood/status/1554672065319419904,,https://twitter.com/ARKInvest/status/1554643269832871936,0,,,,,,,,"{'user_id': None, 'username': None}",,,,
1551763298122711040,1551763298122711040	,2022-07-26 10:56:15 Malay Peninsula Standard Time,2022-07-26,10:56:15,+0800,2361631088,cathiedwood,Cathie Wood,,Important research from @skorusARK on #Bitcoin’s potential role in transforming methane emissions into bitcoin mining that will turbocharge electricity generated by solar and wind. @skorusARK,en,"['skorusark', 'skorusark']",[],[],189,129,772,['bitcoin'],[],https://twitter.com/CathieDWood/status/1551763298122711040,,https://twitter.com/skorusARK/status/1551643120286171137,0,,,,,,,,"{'user_id': None, 'username': None}",,,,
1550591324356653056,1550591324356653056	,2022-07-23 05:19:14 Malay Peninsula Standard Time,2022-07-23,05:19:14,+0800,2361631088,cathiedwood,Cathie Wood,,"If you would like to understand - and help others understand. - how AI and other technologies will transform the world, apply for a research position at ARK!",en,[],[],[],150,77,827,[],[],https://twitter.com/CathieDWood/status/1550591324356653056,,https://twitter.com/wintonARK/status/1549438842624565248,0,,,,,,,,"{'user_id': None, 'username': None}",,,,
1548434099676725249,1548434099676725249	,2022-07-17 06:27:12 Malay Peninsula Standard Time,2022-07-17,06:27:12,+0800,2361631088,cathiedwood,Cathie Wood,,"DeFi’s smart contracts and transparency seem to be provocative antidotes to the toll takers, opacity, and uncertainty in traditional financial markets. As a result, DeFi should continue to gain share.",en,[],[],[],166,257,1439,[],[],https://twitter.com/CathieDWood/status/1548434099676725249,,https://twitter.com/wintonARK/status/1547360646588940288,0,,,,,,,,"{'user_id': None, 'username': None}",,,,
1548420142098395137,1548420142098395137	,2022-07-17 05:31:44 Malay Peninsula Standard Time,2022-07-17,05:31:44,+0800,2361631088,cathiedwood,Cathie Wood,,"According to @ARKInvest’s research, batteries &amp; software will disrupt the  auto industry seriously during the next five years. In this blog, @skorusARK illustrates how a ~25% increase in demand could hurt the enterprise value of the auto industry, with or without autonomous EVs.",en,"['arkinvest', 'skorusark']",[],[],101,78,646,[],[],https://twitter.com/CathieDWood/status/1548420142098395137,,https://twitter.com/skorusARK/status/1548100039729262592,0,,,,,,,,"{'user_id': None, 'username': None}",,,,
1545607887808040965,1545607880811991042	,2022-07-09 11:16:51 Malay Peninsula Standard Time,2022-07-09,11:16:51,+0800,2361631088,cathiedwood,Cathie Wood,,"In the first part of this thread, our In The Know YouTube video starts with the bad news: the Fed is focused on lagging indicators and is making policy mistakes. It concludes with good news: soon, the Fed will ease in response to much weaker economic and inflation indicators.",en,[],[],[],54,29,417,[],[],https://twitter.com/CathieDWood/status/1545607887808040965,,,0,,,,,,,,"{'user_id': '2361631088', 'username': 'CathieDWood'}",,,,
1545607884494569472,1545607880811991042	,2022-07-09 11:16:50 Malay Peninsula Standard Time,2022-07-09,11:16:50,+0800,2361631088,cathiedwood,Cathie Wood,,"In our view, small businesses are trying to salvage profitability in what they perceive as recession. If they are correct, and we believe they are, then the profit margins of larger companies that are hoarding labor will suffer as their productivity collapses.",en,[],[],[],31,19,360,[],[],https://twitter.com/CathieDWood/status/1545607884494569472,,,0,,,,,,,,"{'user_id': '2361631088', 'username': 'CathieDWood'}",,,,
